{
  "schema_version": "1.0.0",
  "method_version": "pytorch-leads-v1",
  "generated_at": "2026-03-05T10:05:13+00:00",
  "experiment": {
    "id": "webinar__pre__pytorch-leads-v1__r003",
    "repo_id": "webinar",
    "repo_variant": "pre",
    "run_id": "r003"
  },
  "repo": {
    "path": "/Users/assaf/Dropbox/tensorleap/worktrees/concierge/research/inputs/.fixtures/webinar/pre",
    "python_files_scanned": 4
  },
  "signals": [
    {
      "id": "dataloader_import",
      "description": "Imports from torch.utils.data related to DataLoader",
      "weight": 6.0,
      "tier": "primary"
    },
    {
      "id": "dataloader_call",
      "description": "DataLoader(...) call site",
      "weight": 10.0,
      "tier": "primary"
    },
    {
      "id": "dataset_subclass",
      "description": "class X(...Dataset...) definition",
      "weight": 8.0,
      "tier": "primary"
    },
    {
      "id": "dataset_import",
      "description": "Dataset import from torch.utils.data",
      "weight": 5.0,
      "tier": "primary"
    },
    {
      "id": "train_fn",
      "description": "Training function definition",
      "weight": 6.0,
      "tier": "primary"
    },
    {
      "id": "validate_fn",
      "description": "Validation/evaluation function definition",
      "weight": 6.0,
      "tier": "primary"
    },
    {
      "id": "main_entry",
      "description": "Python __main__ entry point",
      "weight": 3.0,
      "tier": "primary"
    },
    {
      "id": "collate_fn",
      "description": "collate_fn mention",
      "weight": 5.0,
      "tier": "secondary"
    },
    {
      "id": "batch_unpack_loop",
      "description": "for-loop tuple unpacking pattern",
      "weight": 5.0,
      "tier": "secondary"
    },
    {
      "id": "transform_chain",
      "description": "transform/torchvision transform usage",
      "weight": 4.0,
      "tier": "secondary"
    },
    {
      "id": "model_call",
      "description": "model(...) invocation",
      "weight": 3.0,
      "tier": "secondary"
    },
    {
      "id": "criterion_call",
      "description": "criterion(...) invocation",
      "weight": 2.0,
      "tier": "secondary"
    }
  ],
  "files": [
    {
      "path": "webinar/utils/metrics.py",
      "score": 10.0,
      "signal_hits": [
        {
          "signal_id": "batch_unpack_loop",
          "count": 2,
          "contribution": 10.0,
          "occurrences": [
            {
              "line": 121,
              "snippet": "for i, prediction in enumerate(prediction_detected):"
            },
            {
              "line": 140,
              "snippet": "for k, gt_detection in enumerate(gt_detected):"
            }
          ]
        }
      ]
    }
  ],
  "totals": {
    "files_with_hits": 1,
    "signal_hit_count": 2
  }
}
